title,kind,release_date,source,source_url,summary,poster_url,updated_at
Katie Pavlich Tonight,series,2026-06-15,TVMaze US,https://www.tvmaze.com/shows/90157/katie-pavlich-tonight,Katie Pavlich Tonight offers a conservative take on the day's events while welcoming all viewpoints. The goal: cutting through left-right bias in pursuit of plain facts and honest analysis.,https://static.tvmaze.com/uploads/images/medium_portrait/611/1529530.jpg,2026-06-20T06:44:22+00:00
For My Man,series,2026-06-15,TVMaze US,https://www.tvmaze.com/shows/2921/for-my-man,"For My Man features the outrageous and shocking stories of women who have been arrested for a crime they committed in the name of love. From a killing spree across the mid-west to an inside informant at the DEA, these women have no limits as to how far they will go to support their men. These are the stories of the obsessions and weakness that fueled their fall from grace.",https://static.tvmaze.com/uploads/images/medium_portrait/207/517589.jpg,2026-06-20T06:44:22+00:00
CNN NewsNight with Abby Phillip,series,2026-06-15,TVMaze US,https://www.tvmaze.com/shows/71645/cnn-newsnight-with-abby-phillip,"In CNN NewsNight with Abby Phillip , she delivers a thoughtful, sharp approach to the day's biggest stories.",https://static.tvmaze.com/uploads/images/medium_portrait/614/1536140.jpg,2026-06-20T06:44:22+00:00
90 Day: The Last Resort Between the Sheets,series,2026-06-15,TVMaze US,https://www.tvmaze.com/shows/80345/90-day-the-last-resort-between-the-sheets,"90 Day: The Last Resort Between the Sheets is an unfiltered, one-hour after-show that dives deeper into each week's episodes. Cast members from this season of 90 Day: The Last Resort will provide behind-the-scenes commentary and personal reflections on their experiences at the resort. Through never-before-seen footage, and unique therapist interviews, viewers will get an exclusive insider look at what really went down when the cameras were and weren't rolling. This has all the juicy secrets, hilarious anecdotes and emotional moments as your favorite couples dissect jaw dropping scenes.",https://static.tvmaze.com/uploads/images/medium_portrait/546/1365376.jpg,2026-06-20T06:44:22+00:00
Late Night Law,series,2026-06-15,TVMaze US,https://www.tvmaze.com/shows/92484/late-night-law,Ride along as officers face the dangers and decisions that define the night shift.,https://static.tvmaze.com/uploads/images/medium_portrait/628/1571557.jpg,2026-06-20T06:44:22+00:00
History's Greatest Machines with Dolph Lundgren,series,2026-06-15,TVMaze US,https://www.tvmaze.com/shows/91342/historys-greatest-machines-with-dolph-lundgren,"Machines can rewrite history – and no one knows that better than action legend and chemical engineer graduate Dolph Lundgren. Join him as he uncovers the stories behind history's most groundbreaking machines: witness secret stealth helicopters, spy planes outrunning missiles, espionage tech that won wars, to the rocket that took humanity to the moon. Guided by Dolph's keen insight and charisma, this is a thrilling ride through the gears, guts, and genius behind the machines that reshaped our world.",https://static.tvmaze.com/uploads/images/medium_portrait/625/1564660.jpg,2026-06-20T06:44:22+00:00
SEC Now,series,2026-06-15,TVMaze US,https://www.tvmaze.com/shows/8661/sec-now,"The flagship news and information program of the SEC Network -- ESPN's 24/7 multiplatform sports network devoted to the Southeastern Conference -- is SEC Now , broadcast weekdays from the network's studios in Charlotte, N.C. Hosted by Dari Nowkhah, the show includes a mix of sports coverage, in-depth features, insider access, and exclusive interviews with the movers and shakers of the conference's 14 teams.",https://static.tvmaze.com/uploads/images/medium_portrait/30/77094.jpg,2026-06-20T06:44:22+00:00
Watch What Happens Live,series,2026-06-15,TVMaze US,https://www.tvmaze.com/shows/2836/watch-what-happens-live,"Watch What Happens Live is an interactive series hosted by Bravo programming executive Andy Cohen, Bravo's Senior Vice President of Original Programming and Development, is best known to viewers as the host of the network's often explosive Watch What Happen s reunion specials. Watch What Happens originally debuted as a live online show on www.bravotv.com. Watch What Happens welcomes guests from some of the cable network's most popular series, as well as other entertainment stars, to chat about pop culture and celebrities in the news!",https://static.tvmaze.com/uploads/images/medium_portrait/593/1484372.jpg,2026-06-20T06:44:22+00:00
The Daily Show,series,2026-06-15,TVMaze US,https://www.tvmaze.com/shows/66198/the-daily-show,"Hosted by a rotating cast of comedy greats, The Daily Show remains the go-to source for provocative satire, insightful interviews and an award-winning team of correspondents and contributors.",https://static.tvmaze.com/uploads/images/medium_portrait/567/1419577.jpg,2026-06-20T06:44:22+00:00
The 11th Hour with Ali Velshi,series,2026-06-15,TVMaze US,https://www.tvmaze.com/shows/61605/the-11th-hour-with-ali-velshi,"Ali Velshi delivers sharp, data-driven analysis of the day's biggest stories.",https://static.tvmaze.com/uploads/images/medium_portrait/619/1549476.jpg,2026-06-20T06:44:22+00:00
Jesse Weber Live,series,2026-06-15,TVMaze US,https://www.tvmaze.com/shows/90158/jesse-weber-live,"A fresh, fast-paced, and often unexpected take on the day's headlines, diving into the biggest stories through the lens of an expert in legal affairs.",https://static.tvmaze.com/uploads/images/medium_portrait/611/1529553.jpg,2026-06-20T06:44:22+00:00
Laura Coates Live,series,2026-06-15,TVMaze US,https://www.tvmaze.com/shows/71591/laura-coates-live,"In Laura Coates Live , Laura goes inside the story with a relentless pursuit of the facts. She is CNN's chief legal analyst, playing a central role in the network's extensive legal programming.",https://static.tvmaze.com/uploads/images/medium_portrait/614/1536141.jpg,2026-06-20T06:44:22+00:00
Jimmy Kimmel Live,series,2026-06-15,TVMaze US,https://www.tvmaze.com/shows/1388/jimmy-kimmel-live,"Jimmy Kimmel Live features a diverse lineup of guests that include celebrities, athletes, musical acts, comedians and human-interest subjects, along with comedy bits and a house band.",https://static.tvmaze.com/uploads/images/medium_portrait/565/1413031.jpg,2026-06-20T06:44:22+00:00
The Tonight Show Starring Jimmy Fallon,series,2026-06-15,TVMaze US,https://www.tvmaze.com/shows/718/the-tonight-show-starring-jimmy-fallon,"Emmy Award and Grammy Award winner Jimmy Fallon brought NBC's ""The Tonight Show"" back to its New York origins when he launched The Tonight Show Starring Jimmy Fallon from Rockefeller Center. Fallon puts his own stamp on the storied NBC late-night franchise with his unique comedic wit, on-point pop culture awareness, welcoming style and impeccable taste in music with the award-winning house band, The Roots.",https://static.tvmaze.com/uploads/images/medium_portrait/534/1335993.jpg,2026-06-20T06:44:22+00:00
The Story Is with Elex Michaelson,series,2026-06-15,TVMaze US,https://www.tvmaze.com/shows/87855/the-story-is-with-elex-michaelson,"The Story Is will feature live nightly panels and debates on set featuring a range of voices including attorneys Gloria Allred and Areva Martin, conservative talk radio hosts Larry Elder and Jennifer Horn, progressive podcast host Brian Tyler Cohen, former California GOP chair Jessica Millan Patterson and journalists Peter Hamby from Puck and POLITICO's Melanie Mason.",https://static.tvmaze.com/uploads/images/medium_portrait/614/1536142.jpg,2026-06-20T06:44:23+00:00
Late Night with Seth Meyers,series,2026-06-15,TVMaze US,https://www.tvmaze.com/shows/363/late-night-with-seth-meyers,"Seth Meyers, who is Saturday Night Live's longest serving anchor on the show's wildly popular ""Weekend Update,"" takes over as host of NBC's Late Night — home to A-list celebrity guests, memorable comedy and the best in musical talent. As the Emmy Award-winning head writer for ""SNL,"" Meyers has established a reputation for sharp wit and perfectly timed comedy, and has gained fame for his spot-on jokes and satire. Meyers takes his departure from ""SNL"" to his new post at ""Late Night,"" as Jimmy Fallon moves to The Tonight Show.",https://static.tvmaze.com/uploads/images/medium_portrait/506/1265488.jpg,2026-06-20T06:44:23+00:00
Fashion Forward,series,2026-06-14,TVMaze US,https://www.tvmaze.com/shows/78808/fashion-forward,"Fashion Forward is a weekly series that gives you an inside look into the glamorous world of the most stylish stars. Keep up with the latest news, check out what the most influential models are up to on social media, get to know their beauty secrets and learn how to dress like your favourite celebs.",https://static.tvmaze.com/uploads/images/medium_portrait/530/1325870.jpg,2026-06-20T06:44:22+00:00
Weather Command Weekend,series,2026-06-14,TVMaze US,https://www.tvmaze.com/shows/92375/weather-command-weekend,Stay up to date inside the Weather Command center with a weekend forecast and real-time alerts.,,2026-06-20T06:44:22+00:00
The Weekend,series,2026-06-14,TVMaze US,https://www.tvmaze.com/shows/73112/the-weekend,Fresh analysis of the week's biggest events and a rotating crew of major D.C. newsmakers.,https://static.tvmaze.com/uploads/images/medium_portrait/613/1532637.jpg,2026-06-20T06:44:22+00:00
Wake Up America Weekend,series,2026-06-14,TVMaze US,https://www.tvmaze.com/shows/76932/wake-up-america-weekend,"Start your weekend days with real news and analysis from Michael Grimm, Sarah Williamson and team.",,2026-06-20T06:44:22+00:00
Good Morning America: Weekend Edition,series,2026-06-14,TVMaze US,https://www.tvmaze.com/shows/18876/good-morning-america-weekend-edition,"GMA Weekend expanded to seven days a week in September 2004, providing up-to-the-minute news, weather and topical features from the familiar set of the weekday program located at the crossroads of the world, Times Square. The show's increased focus on lifestyle, leisure and family-oriented topics are suited for the relaxed pace of the weekend, attracting engaged and loyal GMA viewers as they start their days. Co-anchors Dan Harris and Paula Faris bring great energy and vitality to the morning show. In his 11 years at ABC News, Dan has traveled the globe, reporting from Haiti, Pakistan, Afghanistan, Iraq, Ground Zero, South Korea, Israel and the West Bank. His interests range from international affairs and politics to technology and indie music. Former anchor of ABC's World News Now and America This Morning, Paula delivered unforgettable and colorful accounts from the World Cup. Her popular Real Money reports have shown American families how to save thousands of dollars. As the audience on the weekend continues to grow, GMA is now the #1 morning newscast on Saturdays and regularly beats NBC's Today on Sunday mornings.",https://static.tvmaze.com/uploads/images/medium_portrait/301/754982.jpg,2026-06-20T06:44:22+00:00
Sunday TODAY with Willie Geist,series,2026-06-14,TVMaze US,https://www.tvmaze.com/shows/23602/sunday-today-with-willie-geist,"Sunday TODAY with Willie Geist delivers morning news, videos, and photos about current events.",https://static.tvmaze.com/uploads/images/medium_portrait/127/319778.jpg,2026-06-20T06:44:22+00:00
Meet the Press,series,2026-06-14,TVMaze US,https://www.tvmaze.com/shows/8835/meet-the-press,"For almost as long as there has been television, there's been Meet the Press . The hourlong Sunday morning public affairs program has featured interviews with countless U.S. and world leaders, and has reviewed, analyzed and discussed the news of the week -- all while looking toward the week ahead.",https://static.tvmaze.com/uploads/images/medium_portrait/534/1335995.jpg,2026-06-20T06:44:22+00:00
CBS News Sunday Morning,series,2026-06-14,TVMaze US,https://www.tvmaze.com/shows/15779/cbs-news-sunday-morning,CBS News Sunday Morning is a early morning news and magazine program that airs on Sunday's on CBS.,https://static.tvmaze.com/uploads/images/medium_portrait/593/1482534.jpg,2026-06-20T06:44:22+00:00
State of the Union with Jake Tapper and Dana Bash,series,2026-06-14,TVMaze US,https://www.tvmaze.com/shows/72487/state-of-the-union-with-jake-tapper-and-dana-bash,"Jake Tapper and Dana Bash bring together major newsmakers, analysts and experts to tackle pressing domestic issues and diplomacy on the global stage.",https://static.tvmaze.com/uploads/images/medium_portrait/510/1275006.jpg,2026-06-20T06:44:22+00:00
Connect with Jacob Soboroff,series,2026-06-14,TVMaze US,https://www.tvmaze.com/shows/91899/connect-with-jacob-soboroff,"Connect with Jacob Soboroff will be the network's first Los Angeles-based program. Built around the connection Soboroff has forged with the MS NOW audience for more than a decade, Connect will bring viewers closer to the stories shaping the country. Connect will also bring Soboroff's storied reporting from the ground in Los Angeles and beyond to help connect the dots between what's happening in local communities throughout the country and larger national conversations driving politics, culture, and daily life.",https://static.tvmaze.com/uploads/images/medium_portrait/627/1569957.jpg,2026-06-20T06:44:22+00:00
ABC News Live Weekend,series,2026-06-14,TVMaze US,https://www.tvmaze.com/shows/78500/abc-news-live-weekend,ABC News Live Weekend will feature the biggest stories of the week with all the facts and analysis viewers need to reflect on global events and prepare for what's coming next.,https://static.tvmaze.com/uploads/images/medium_portrait/528/1320416.jpg,2026-06-20T06:44:22+00:00
This Week,series,2026-06-14,TVMaze US,https://www.tvmaze.com/shows/8833/this-week,"This Week is hosted by former Clinton White House staffer and current co-anchor of ABC's weekday morning news show ""Good Morning America"", George Stephanopoulos offers a look at current events with a focus on the politics of the day. Each week's show includes interviews with top newsmakers (including some of the nation's top political leaders) as well as a roundtable discussion, usually featuring journalists from ABC and other news organizations, of the week's happenings. Since 2008, the program has broadcast from a studio at the Newseum in Washington, D.C.",https://static.tvmaze.com/uploads/images/medium_portrait/359/898306.jpg,2026-06-20T06:44:22+00:00
Sunday Morning Futures with Maria Bartiromo,series,2026-06-14,TVMaze US,https://www.tvmaze.com/shows/10854/sunday-morning-futures-with-maria-bartiromo,"As part of her role as FOX Business Network's global markets editor, business journalist Maria Bartiromo hosts this weekly Sunday morning show on FBN sister network FOX News Channel Sunday Morning Futures with Maria Bartiromo that focuses more on the general economy than the stock market specifically. The hourlong show provides viewers with information about how recent news events affect the economy. In addition, Bartiromo interviews business leaders and newsmakers on topics that include job creation and investment opportunities.",https://static.tvmaze.com/uploads/images/medium_portrait/614/1536197.jpg,2026-06-20T06:44:22+00:00
Face the Nation,series,2026-06-14,TVMaze US,https://www.tvmaze.com/shows/8834/face-the-nation,"Face the Nation is a news interview program which airs every Sunday morning, live from the CBS studio in Washington D.C. It is dedicated to interviewing newsmakers on the latest issues. Guests include government leaders, politicians, and international figures in the news. CBS News… More correspondents engage the guests in a lively roundtable discussion focusing on current topics. The show started on November 7th, 1954, and was originally broadcast on both CBS Television and Radio Networks. After close to two decades, the program was taken off CBS radio.",https://static.tvmaze.com/uploads/images/medium_portrait/513/1283062.jpg,2026-06-20T06:44:22+00:00
Alex Witt Reports,series,2026-06-14,TVMaze US,https://www.tvmaze.com/shows/9956/alex-witt-reports,"The latest breaking news, reporting and live coverage of the day's important stories; hosted by trusted NBC News journalists, these dynamic hours offer discussions with newsmakers, journalists and politicians.",https://static.tvmaze.com/uploads/images/medium_portrait/613/1532634.jpg,2026-06-20T06:44:22+00:00
PoliticsNation,series,2026-06-14,TVMaze US,https://www.tvmaze.com/shows/10815/politicsnation,Rev. Al Sharpton highlights important political stories and issues that require a national platform.,https://static.tvmaze.com/uploads/images/medium_portrait/619/1549262.jpg,2026-06-20T06:44:22+00:00
Naked News,series,2026-06-14,TVMaze US,https://www.tvmaze.com/shows/32095/naked-news,"Naked News , billing itself as ""the program with nothing to hide"", is a subscription website featuring a real television newscast. The show is prepared in Toronto and runs daily, with 25-minute episodes 6 days per week. The female anchors read the news fully nude or strip as they present their news segments. Naked News TV is its offshoot pay-per-view or subscription service. Naked News also aired briefly as a late night television series on Citytv Toronto.",https://static.tvmaze.com/uploads/images/medium_portrait/594/1485305.jpg,2026-06-20T06:44:22+00:00
Snapped: Killer Couples,series,2026-06-14,TVMaze US,https://www.tvmaze.com/shows/4531/snapped-killer-couples,"Snapped: Killer Couples features couples whose passion drives them to commit terrible criminal acts. Through recreations and gripping firsthand accounts, each episode takes a deep dive into the stories behind the couples' romance, how their relationship evolved once love turned into manipulation and what ultimately drove them to commit the crime.",https://static.tvmaze.com/uploads/images/medium_portrait/557/1394495.jpg,2026-06-20T06:44:22+00:00
The Weekend Primetime,series,2026-06-14,TVMaze US,https://www.tvmaze.com/shows/83807/the-weekend-primetime,"A diverse panel of journalists navigates the week's biggest stories and sets the agenda for the week ahead, offering context, analysis, and civil debate in a three-hour Saturday and Sunday evening format.",https://static.tvmaze.com/uploads/images/medium_portrait/614/1536184.jpg,2026-06-20T06:44:22+00:00
Collector's Call,series,2026-06-14,TVMaze US,https://www.tvmaze.com/shows/41623/collectors-call,"Collector's Call , Hosted by Lisa Whelchel (Blair on The Facts of Life ), the 13-episode unscripted series will introduce you to some of the biggest collectors of pop culture memorabilia in the country.",https://static.tvmaze.com/uploads/images/medium_portrait/401/1003086.jpg,2026-06-20T06:44:22+00:00
NBC Nightly News,series,2026-06-14,TVMaze US,https://www.tvmaze.com/shows/9539/nbc-nightly-news,"NBC Nightly News is the most-watched evening newscast in America, providing the very latest on the day's top stories and going beyond the headlines to add context and analysis to the most pressing issues of our time, both at home and abroad. We go to the heart of breaking news stories, introduce you to everyday people caught up in extraordinary events, offer in-depth reporting on health and medicine, cover international news as it unfolds and we profile those who inspire us to do better in our popular Making A Difference reports. The award-winning broadcast carries a legacy that spans more than six decades, beginning in 1948 - when NBC started broadcasting television's first-ever regularly scheduled network evening newscast.",https://static.tvmaze.com/uploads/images/medium_portrait/571/1428167.jpg,2026-06-20T06:44:22+00:00
ABC World News Tonight with David Muir,series,2026-06-14,TVMaze US,https://www.tvmaze.com/shows/9659/abc-world-news-tonight-with-david-muir,"With unparalleled resources, World News Tonight with David Muir provides the latest information and analysis of major events from around the country and the world.",https://static.tvmaze.com/uploads/images/medium_portrait/606/1515438.jpg,2026-06-20T06:44:22+00:00
CBS Weekend News,series,2026-06-14,TVMaze US,https://www.tvmaze.com/shows/72798/cbs-weekend-news,"CBS Weekend News offers the latest headlines, original reporting and in-depth pieces that add context and perspective to the world's events.",https://static.tvmaze.com/uploads/images/medium_portrait/572/1432072.jpg,2026-06-20T06:44:22+00:00
The Killer Among Us,series,2026-06-14,TVMaze US,https://www.tvmaze.com/shows/84624/the-killer-among-us,"Hosted by Alan Cumming, a shocking murder rocks a tight-knit community to its core. But what if the crime wasn't committed by a stranger or outsider? What if this killer is part of the community itself? Cumming brings us straight into the heart of communities where the unthinkable has happened and no one knows why — or who is responsible. If everyone is a suspect… who can you trust? With multiple suspects, layers of lies, deceit and deception, The Killer Among Us is a murder mystery where someone is playing… but it's not a game.",https://static.tvmaze.com/uploads/images/medium_portrait/626/1566207.jpg,2026-06-20T06:44:22+00:00
The Real Housewives of Atlanta,series,2026-06-14,TVMaze US,https://www.tvmaze.com/shows/597/the-real-housewives-of-atlanta,"An up-close and personal look at life in Hotlanta, The Real Housewives of Atlanta follows five glamorous southern belles as they balance motherhood, demanding careers and a fast-paced social calendar, and shows what life is like in the most exclusive areas of Atlanta. These driven and ambitious women prove that they're not just ""housewives,"" but entrepreneurs, doting mothers and classy southern women. These ladies show the world what it takes to live large in some of the hottest zip codes in the south.",https://static.tvmaze.com/uploads/images/medium_portrait/620/1550168.jpg,2026-06-20T06:44:22+00:00
Naked and Afraid: Global Showdown,series,2026-06-14,TVMaze US,https://www.tvmaze.com/shows/91248/naked-and-afraid-global-showdown,"Survivalists from all over the world - including Brazil, Australia, Mexico, and the United States - represent their homelands in a grueling 40-day primitive bushcraft competition. Paired with a partner, their skills, toughness and teamwork will be tested as they compete for national pride and the largest cash prize in franchise history.",https://static.tvmaze.com/uploads/images/medium_portrait/622/1555171.jpg,2026-06-20T06:44:22+00:00
90 Day Fiancé,series,2026-06-14,TVMaze US,https://www.tvmaze.com/shows/3139/90-day-fiance,"90 Day Fiancé offers a unique look into the world of international dating and matrimony. Using a unique 90-day fiance visa, the K-1 visa, four women and two men will travel to the U.S. to live with their overseas partners for the first time. The couples must marry before their visas expire in 90 days, or the visiting partner will have to return home. They'll have to overcome language barriers, culture shock and skeptical friends and family -- all with a clock that starts ticking the moment they step foot on U.S. soil. The stakes are incredibly high as these couples are forced to make a life-altering decision: get married or send their international mate home.",https://static.tvmaze.com/uploads/images/medium_portrait/562/1406211.jpg,2026-06-20T06:44:22+00:00
Variety Studio: Actors on Actors,series,2026-06-14,TVMaze US,https://www.tvmaze.com/shows/43920/variety-studio-actors-on-actors,"Variety Studio: Actors on Actors is an American entertainment talk show television series co-produced by PBS SoCal and Variety Media. It premiered December 21, 2014 on PBS SoCal.",https://static.tvmaze.com/uploads/images/medium_portrait/491/1228389.jpg,2026-06-20T06:44:22+00:00
Renovation Island: The Adventure Continues,series,2026-06-14,TVMaze US,https://www.tvmaze.com/shows/92102/renovation-island-the-adventure-continues,"Bryan and Sarah Baeumler take us inside their world of all things renovation, design, and entrepreneurship as they work on an extensive hotel renovation in the Florida Keys while continuing the expansion of projects at their resort in the Bahamas.",https://static.tvmaze.com/uploads/images/medium_portrait/629/1572715.jpg,2026-06-20T06:44:22+00:00
Grantchester,series,2026-06-14,TVMaze US,https://www.tvmaze.com/shows/1548/grantchester,"Eavesdropping on the life of Sidney Chambers, a charismatic, charming, crime-fighting clergyman, and his partner in crime Police Inspector Geordie Keating, became a highlight for the audience who revelled in their on screen partnership. Geordie's plain-speaking, down to earth approach to policing complemented Sidney's more gentle technique of coaxing information from witnesses and suspects. Their unlikely pairing became a true friendship as each offered a different insight into the crimes they unravelled.",https://static.tvmaze.com/uploads/images/medium_portrait/572/1431930.jpg,2026-06-20T06:44:22+00:00
Hazardous History with Henry Winkler,series,2026-06-14,TVMaze US,https://www.tvmaze.com/shows/83058/hazardous-history-with-henry-winkler,"The eight-episode fast-paced, nostalgia-fueled series will take viewers on a thrilling ride through America's past.",https://static.tvmaze.com/uploads/images/medium_portrait/623/1559541.jpg,2026-06-20T06:44:22+00:00
The Way Home,series,2026-06-14,TVMaze US,https://www.tvmaze.com/shows/62766/the-way-home,The Way Home follows the lives of three generations of women within the Landry family that spans the years through a time travel twist.,https://static.tvmaze.com/uploads/images/medium_portrait/549/1373567.jpg,2026-06-20T06:44:22+00:00
