title,kind,release_date,source,source_url,summary,poster_url,updated_at
Weather Command Weekend,series,2026-06-20,TVMaze US,https://www.tvmaze.com/shows/92375/weather-command-weekend,Stay up to date inside the Weather Command center with a weekend forecast and real-time alerts.,,2026-06-20T06:44:26+00:00
The Weekend,series,2026-06-20,TVMaze US,https://www.tvmaze.com/shows/73112/the-weekend,Fresh analysis of the week's biggest events and a rotating crew of major D.C. newsmakers.,https://static.tvmaze.com/uploads/images/medium_portrait/613/1532637.jpg,2026-06-20T06:44:26+00:00
Wake Up America Weekend,series,2026-06-20,TVMaze US,https://www.tvmaze.com/shows/76932/wake-up-america-weekend,"Start your weekend days with real news and analysis from Michael Grimm, Sarah Williamson and team.",,2026-06-20T06:44:26+00:00
Good Morning America: Weekend Edition,series,2026-06-20,TVMaze US,https://www.tvmaze.com/shows/18876/good-morning-america-weekend-edition,"GMA Weekend expanded to seven days a week in September 2004, providing up-to-the-minute news, weather and topical features from the familiar set of the weekday program located at the crossroads of the world, Times Square. The show's increased focus on lifestyle, leisure and family-oriented topics are suited for the relaxed pace of the weekend, attracting engaged and loyal GMA viewers as they start their days. Co-anchors Dan Harris and Paula Faris bring great energy and vitality to the morning show. In his 11 years at ABC News, Dan has traveled the globe, reporting from Haiti, Pakistan, Afghanistan, Iraq, Ground Zero, South Korea, Israel and the West Bank. His interests range from international affairs and politics to technology and indie music. Former anchor of ABC's World News Now and America This Morning, Paula delivered unforgettable and colorful accounts from the World Cup. Her popular Real Money reports have shown American families how to save thousands of dollars. As the audience on the weekend continues to grow, GMA is now the #1 morning newscast on Saturdays and regularly beats NBC's Today on Sunday mornings.",https://static.tvmaze.com/uploads/images/medium_portrait/301/754982.jpg,2026-06-20T06:44:26+00:00
CBS Saturday Morning,series,2026-06-20,TVMaze US,https://www.tvmaze.com/shows/71918/cbs-saturday-morning,"Hosts Jeff Glor, Dana Jacobson and Michelle Miller provide original reporting, breaking news, and profiles of leading figures in culture and the arts from the Times Square studio on the Saturday edition of the CBS morning news family.",https://static.tvmaze.com/uploads/images/medium_portrait/614/1536212.jpg,2026-06-20T06:44:26+00:00
The Weekend View,series,2026-06-20,TVMaze US,https://www.tvmaze.com/shows/81937/the-weekend-view,"The Weekend View will focus on the biggest stories in entertainment and the buzziest news topping social media feeds. With all-new ""Hot Topics,"" the co-hosts will give their one-of-a-kind takes with their signature candor and humor. Plus, ""The Weekend View"" will include ""Behind the Table"" segments with executive producer Brian Teta and the co-hosts as they dive deeper into pop-culture stories from the week.",https://static.tvmaze.com/uploads/images/medium_portrait/552/1380204.jpg,2026-06-20T06:44:26+00:00
America Right Now,series,2026-06-20,TVMaze US,https://www.tvmaze.com/shows/76969/america-right-now,"Tom Basile tackles the week's biggest stories with top talkers from politics, Hollywood, and across America.",https://static.tvmaze.com/uploads/images/medium_portrait/519/1298172.jpg,2026-06-20T06:44:26+00:00
We Baby Bears,series,2026-06-20,TVMaze US,https://www.tvmaze.com/shows/51025/we-baby-bears,"We Baby Bears features the Baby Bears on their search for a place they can settle down and fit into. Each episode transports them into vibrant and colorful worlds, where they befriend legions of familiar fairytale faces. During their nonstop crusade, they are faced with the decision to stay or to continue on their journey for a permanent abode they can call home.",https://static.tvmaze.com/uploads/images/medium_portrait/416/1041406.jpg,2026-06-20T06:44:26+00:00
Smerconish,series,2026-06-20,TVMaze US,https://www.tvmaze.com/shows/9954/smerconish,"After serving as an MSNBC contributor and guest-host on the network for four years, TV and radio personality Michael Smerconish believed he was ready to head a show of his own. CNN agreed, and thus was born Smerconish , an hour long Saturday morning program that takes after its host's independent views. Using a topical, conversational format, he aims for the TV show to be an extension of his weekday radio broadcast, with free-flowing topics and the ability to discuss issues that strike a chord with the audience. Along the same lines, he thinks it's important to present the content in an engaging manner, free of my-way-or-the-highway ideology. Smerconish, who has a law degree from the University of Pennsylvania, is also a New York Times' best-selling author.",https://static.tvmaze.com/uploads/images/medium_portrait/480/1200346.jpg,2026-06-20T06:44:26+00:00
Connect with Jacob Soboroff,series,2026-06-20,TVMaze US,https://www.tvmaze.com/shows/91899/connect-with-jacob-soboroff,"Connect with Jacob Soboroff will be the network's first Los Angeles-based program. Built around the connection Soboroff has forged with the MS NOW audience for more than a decade, Connect will bring viewers closer to the stories shaping the country. Connect will also bring Soboroff's storied reporting from the ground in Los Angeles and beyond to help connect the dots between what's happening in local communities throughout the country and larger national conversations driving politics, culture, and daily life.",https://static.tvmaze.com/uploads/images/medium_portrait/627/1569957.jpg,2026-06-20T06:44:26+00:00
Zombie House Flipping,series,2026-06-20,TVMaze US,https://www.tvmaze.com/shows/11888/zombie-house-flipping,"When a house has been left for dead, the Zombie House Flippers bring it back to life and into beautifully remade shape for top dollar. These flippers show the inner workings of this high-stakes world full of unexpected disasters, hidden costs, and quirky personalities. With tight budgets and short timelines, it's a mad scramble to finish these flips and make bank for the team.",https://static.tvmaze.com/uploads/images/medium_portrait/544/1361329.jpg,2026-06-20T06:44:26+00:00
ABC News Live Weekend,series,2026-06-20,TVMaze US,https://www.tvmaze.com/shows/78500/abc-news-live-weekend,ABC News Live Weekend will feature the biggest stories of the week with all the facts and analysis viewers need to reflect on global events and prepare for what's coming next.,https://static.tvmaze.com/uploads/images/medium_portrait/528/1320416.jpg,2026-06-20T06:44:26+00:00
Million Dollar Zombie Flips,series,2026-06-20,TVMaze US,https://www.tvmaze.com/shows/82565/million-dollar-zombie-flips,"Million Dollar Zombie Flips follows James Dainard and his team as they hunt for, fix, and flip zombie houses in the Seattle area. In each episode, James brings the cash and teams up with a rookie flipper who finds a dilapidated house and together, they attempt to turn it into a stunning million-dollar home. Following James' plan, the flipping partner is in charge of the renovation process and if all goes smoothly, they split the profit 50/50. However, if the newbie can't meet the team's standards, James will take over and keep the full profit for himself. With millions of dollars on the line, do these real-estate newbies have what it takes to turn big bucks in the high-stakes world of flipping?",https://static.tvmaze.com/uploads/images/medium_portrait/557/1394167.jpg,2026-06-20T06:44:26+00:00
Saturday Report,series,2026-06-20,TVMaze US,https://www.tvmaze.com/shows/76970/saturday-report,Rita Cosby and Jon Glasgow tackles the big headlines with smart analysis from top experts.,,2026-06-20T06:44:26+00:00
Zombie House Flipping: Family Business,series,2026-06-20,TVMaze US,https://www.tvmaze.com/shows/92371/zombie-house-flipping-family-business,"In Columbus, Ohio, power flipper Tommy Harr and his family have built a business on seeing opportunity where others see disaster. Their edge comes from within the family — two generations of elite home inspectors, a fearless construction crew led by his middle brother, and a mom who doubles as both designer and real estate agent. Together, they take on the city's worst ""zombie"" houses, transforming rundown properties into stunning dream homes.",https://static.tvmaze.com/uploads/images/medium_portrait/629/1572852.jpg,2026-06-20T06:44:26+00:00
Saturday Agenda,series,2026-06-20,TVMaze US,https://www.tvmaze.com/shows/76915/saturday-agenda,Rob Astorino reveals Washington's inner workings and the fight for core values.,,2026-06-20T06:44:26+00:00
Alex Witt Reports,series,2026-06-20,TVMaze US,https://www.tvmaze.com/shows/9956/alex-witt-reports,"The latest breaking news, reporting and live coverage of the day's important stories; hosted by trusted NBC News journalists, these dynamic hours offer discussions with newsmakers, journalists and politicians.",https://static.tvmaze.com/uploads/images/medium_portrait/613/1532634.jpg,2026-06-20T06:44:26+00:00
PoliticsNation,series,2026-06-20,TVMaze US,https://www.tvmaze.com/shows/10815/politicsnation,Rev. Al Sharpton highlights important political stories and issues that require a national platform.,https://static.tvmaze.com/uploads/images/medium_portrait/619/1549262.jpg,2026-06-20T06:44:26+00:00
The Count,series,2026-06-20,TVMaze US,https://www.tvmaze.com/shows/77701/the-count,"Newsmax counts up the top stories of the week, while offering analysis by lawmakers, newsmakers, and policy experts.",,2026-06-20T06:44:26+00:00
The Weekend Primetime,series,2026-06-20,TVMaze US,https://www.tvmaze.com/shows/83807/the-weekend-primetime,"A diverse panel of journalists navigates the week's biggest stories and sets the agenda for the week ahead, offering context, analysis, and civil debate in a three-hour Saturday and Sunday evening format.",https://static.tvmaze.com/uploads/images/medium_portrait/614/1536184.jpg,2026-06-20T06:44:26+00:00
SEC Now,series,2026-06-20,TVMaze US,https://www.tvmaze.com/shows/8661/sec-now,"The flagship news and information program of the SEC Network -- ESPN's 24/7 multiplatform sports network devoted to the Southeastern Conference -- is SEC Now , broadcast weekdays from the network's studios in Charlotte, N.C. Hosted by Dari Nowkhah, the show includes a mix of sports coverage, in-depth features, insider access, and exclusive interviews with the movers and shakers of the conference's 14 teams.",https://static.tvmaze.com/uploads/images/medium_portrait/30/77094.jpg,2026-06-20T06:44:26+00:00
AEW: Collision,series,2026-06-20,TVMaze US,https://www.tvmaze.com/shows/68778/aew-collision,"This live, two-hour, in-ring show will air every Saturday night from 8-10 p.m. ET and feature more wrestlers, more stories and more action to super-serve fans. AEW: Collision will feature headliners including Miro, Samoa Joe, Thunder Rosa, Powerhouse Hobbs, and Andrade El Idolo.",https://static.tvmaze.com/uploads/images/medium_portrait/572/1432197.jpg,2026-06-20T06:44:26+00:00
Svengoolie,series,2026-06-20,TVMaze US,https://www.tvmaze.com/shows/22734/svengoolie,"MeTV is opening up the dungeon door and unleashing... Svengoolie ! Svengoolie has been the premiere horror show icon of Chicago, since multiple Emmy award winner Rich Koz became the hand-picked successor to the original Svengoolie back in the late 70s. Since then, generations of viewers have become fans of the monstrous mirth and movies that this video vampire dispenses every week over the airwaves!",https://static.tvmaze.com/uploads/images/medium_portrait/84/210496.jpg,2026-06-20T06:44:26+00:00
On Patrol: First Shift,series,2026-06-20,TVMaze US,https://www.tvmaze.com/shows/63525/on-patrol-first-shift,"On Patrol: Live's Dan Abrams, Sean ""Sticks"" Larkin, and Curtis Wilson provide a sneak peek at tonight's On Patrol: Live and share favorite moments from previous programs.",https://static.tvmaze.com/uploads/images/medium_portrait/418/1046660.jpg,2026-06-20T06:44:26+00:00
Storage Wars: Back to the Locker,series,2026-06-20,TVMaze US,https://www.tvmaze.com/shows/85784/storage-wars-back-to-the-locker,"Storage Wars: Back to the Locker refers to a series of episodes within the larger ""Storage Wars"" series, where the focus is on the competitive bidding and treasure hunting within abandoned storage units. These episodes continue the main show's premise of professional buyers vying to acquire the contents of storage lockers, often with the hope of finding valuable items among the discarded belongings. The ""Back to the Locker"" part emphasizes the return to the core concept of exploring what lies behind the doors of these storage units.",,2026-06-20T06:44:26+00:00
Heart & Hustle: Houston,series,2026-06-20,TVMaze US,https://www.tvmaze.com/shows/84731/heart-hustle-houston,"Heart & Hustle: Houston (wt), produced by Jesse Collins Entertainment in their first-ever foray into the unscripted ensemble arena, follows a dynamic sisterhood of successful Black women in the vibrant heart of Houston. These women are redefining what it means to be a boss, a wife and a mother, while navigating a labyrinth of unique daily challenges. Despite appearing to ‘have it all,' they face insecurities and pressures to maintain a perfect image. Their unbreakable bond of friendship and support helps them rise above the chaos, reminding them it's okay to be ‘perfectly imperfect.'",https://static.tvmaze.com/uploads/images/medium_portrait/624/1561505.jpg,2026-06-20T06:44:26+00:00
My View with Lara Trump,series,2026-06-20,TVMaze US,https://www.tvmaze.com/shows/83839/my-view-with-lara-trump,"My View with Lara Trump features big picture analysis and interviews with thought leaders, shedding light on the headlines driving the national conversation and affecting families around the country.",https://static.tvmaze.com/uploads/images/medium_portrait/614/1536219.jpg,2026-06-20T06:44:26+00:00
Storage Wars,series,2026-06-20,TVMaze US,https://www.tvmaze.com/shows/860/storage-wars,"Storage Wars follows professional buyers and their teams as they scour repossessed storage units in search of hidden treasure. Part gamblers, part detectives, these auction pros have found everything from coffins to the world's most valuable comic book collection, paying as little as ten dollars for items valued in the millions. Each episode of Storage Wars follows a group of bidders as they get a quick peek inside the units, aided only by the beam of a flashlight. They then must assess on the spot if the unit is worth a bid and how high they will actually go to grasp the gold. The high-stakes fun begins as we see if the resulting buy is full of mostly trash... or true treasure.",https://static.tvmaze.com/uploads/images/medium_portrait/583/1457809.jpg,2026-06-20T06:44:26+00:00
On Patrol: Live,series,2026-06-20,TVMaze US,https://www.tvmaze.com/shows/62603/on-patrol-live,"Hosting and executive producing On Patrol: Live is Dan Abrams, CEO and Founder of Abrams Media, host of Dan Abrams Live on NewsNation, Chief Legal Analyst for ABC News, and former host of Live PD . Joining Abrams is Sgt. Sean ""Sticks"" Larkin, retired Tulsa Police Department lieutenant with nearly 25 years of service, and Deputy Sheriff Curtis Wilson , Division Commander with the Richland County Sheriff's Department in Columbia, SC.",https://static.tvmaze.com/uploads/images/medium_portrait/615/1539722.jpg,2026-06-20T06:44:26+00:00
Love Island,series,2026-06-20,TVMaze US,https://www.tvmaze.com/shows/42289/love-island,"U.S. version of the British show Love Island where a group of singles come to stay in a villa for a few weeks and have to couple up with one another – those who fail to find a partner to couple up with risk being dumped from the island. Islanders are on the lookout for romance, but the road to love doesn't always run smoothly. Challenges abound with new Islander arrivals and dramatic twists as friendships and relationships form. In addition to choosing their partners wisely, Islanders must also win the hearts of viewers who have the opportunity to shape events on screen and ultimately crown one lucky couple the winner, who will then have the chance to walk away with both love and the cash prize.",https://static.tvmaze.com/uploads/images/medium_portrait/627/1568693.jpg,2026-06-20T06:44:26+00:00
My Adventures with Superman,series,2026-06-20,TVMaze US,https://www.tvmaze.com/shows/55414/my-adventures-with-superman,"My Adventures with Superman catches up with twenty-somethings Clark Kent, the bright and driven Lois Lane, and their best friend Jimmy Olsen as they begin to discover who they are and everything they can accomplish together as an investigative reporting team at the Daily Planet.",https://static.tvmaze.com/uploads/images/medium_portrait/528/1320722.jpg,2026-06-20T06:44:26+00:00
Way Too Early,series,2026-06-19,TVMaze US,https://www.tvmaze.com/shows/15308/way-too-early,The fast-paced program brings viewers everything they need to know to start their days--from news and politics to sports and pop culture.,https://static.tvmaze.com/uploads/images/medium_portrait/619/1549472.jpg,2026-06-20T06:44:25+00:00
FOX Weather First,series,2026-06-19,TVMaze US,https://www.tvmaze.com/shows/86122/fox-weather-first,Waking up at 5 am to the first live national forecast of the day; all the latest weather news and everything one needs to prepare for the day ahead.,,2026-06-20T06:44:25+00:00
FOX & Friends First,series,2026-06-19,TVMaze US,https://www.tvmaze.com/shows/9966/fox-friends-first,"Kicking off the day, FOX & Friends First delivers all the headlines viewers may have missed overnight, along with a preview of upcoming news events. Presented two hours before FOX & Friends, the first hour of the program is hosted by Todd Piro and Carley Shimkus",https://static.tvmaze.com/uploads/images/medium_portrait/614/1536193.jpg,2026-06-20T06:44:25+00:00
Morning Joe,series,2026-06-19,TVMaze US,https://www.tvmaze.com/shows/15309/morning-joe,"On Morning Joe , the hosts Joe Scarborough, Mika Brzezinski, and Willie Geist engage in dynamic discussion about political news and issues important to all Americans. Morning Joe attracts a variety of guests, including top newsmakers, politicians and cultural influencers.",https://static.tvmaze.com/uploads/images/medium_portrait/619/1549478.jpg,2026-06-20T06:44:25+00:00
Wake Up America Early,series,2026-06-19,TVMaze US,https://www.tvmaze.com/shows/86410/wake-up-america-early,"Wake up to reliable reporting that delivers the essential facts you need to start your day informed, along with expert commentary and thoughtful analysis. Get an early look at the top stories shaping national and global conversations. Whether it's politics, business, culture, or breaking news, you'll be prepared for whatever the day brings.",,2026-06-20T06:44:25+00:00
Morning in America,series,2026-06-19,TVMaze US,https://www.tvmaze.com/shows/76534/morning-in-america,Morning in America is NewsNation's live national morning newscast hosted by Markie Martin.,https://static.tvmaze.com/uploads/images/medium_portrait/519/1297794.jpg,2026-06-20T06:44:25+00:00
Mornings with Maria,series,2026-06-19,TVMaze US,https://www.tvmaze.com/shows/71565/mornings-with-maria,Veteran business journalist Maria Bartiromo brings her knowledge of the financial industry to this early show that features a roundtable of rotating industry experts alongside the host. Bartiromo and her guests discuss news stories -- domestic and international -- and other topics that are expected to impact the economy and markets that day. The show's intent is to give viewers a jump-start on making moves to get the most out of their investments.,https://static.tvmaze.com/uploads/images/medium_portrait/614/1536222.jpg,2026-06-20T06:44:25+00:00
FOX & Friends,series,2026-06-19,TVMaze US,https://www.tvmaze.com/shows/9965/fox-friends,"FOX & Friends is a conservative American early-morning news and opinion talk show on the Fox News Channel. It begins at 6:00 a.m. Eastern Time with the latest Fox News Live headlines and news of the morning and continues with a variety of segments including current events, interviews, updates of news stories with correspondents, right-leaning analysis from the hosts, and entertainment segments.",https://static.tvmaze.com/uploads/images/medium_portrait/614/1536192.jpg,2026-06-20T06:44:25+00:00
Wake Up America,series,2026-06-19,TVMaze US,https://www.tvmaze.com/shows/76913/wake-up-america,"Start your day and weekend with real news and analysis from Rob Finnerty, Michael Grimm & Sarah Williamson and team.",https://static.tvmaze.com/uploads/images/medium_portrait/522/1306601.jpg,2026-06-20T06:44:25+00:00
Good Morning America,series,2026-06-19,TVMaze US,https://www.tvmaze.com/shows/8566/good-morning-america,"Good Morning America is a two-hour, live program anchored by Robin Roberts, George Stephanopoulos and Michael Strahan. Lara Spencer is the entertainmnt anchor, and Ginger Zee is the chief meteorologist.",https://static.tvmaze.com/uploads/images/medium_portrait/449/1122639.jpg,2026-06-20T06:44:25+00:00
Today,series,2026-06-19,TVMaze US,https://www.tvmaze.com/shows/9564/today,"Today is an American news and talk morning television show that airs on NBC. The program debuted on January 14, 1952. It was the first of its genre on American television and in the world, and is the fifth-longest-running American television series.",https://static.tvmaze.com/uploads/images/medium_portrait/564/1410938.jpg,2026-06-20T06:44:25+00:00
CBS Mornings,series,2026-06-19,TVMaze US,https://www.tvmaze.com/shows/66084/cbs-mornings,"CBS Mornings offers a thoughtful, substantive and insightful source of news and information to a daily audience of 3 million viewers. The Emmy Award-winning broadcast presents a mix of daily news, coverage of developing stories of national and global significance, and interviews with leading figures in politics, business and entertainment.",https://static.tvmaze.com/uploads/images/medium_portrait/605/1514144.jpg,2026-06-20T06:44:25+00:00
Good Morning Football,series,2026-06-19,TVMaze US,https://www.tvmaze.com/shows/21738/good-morning-football,"Prior to the start of the 2016 NFL regular season, NFL Network has announced a new daily morning show, Good Morning Football , premiering Monday, August 1. Hosted by Kay Adams, Nate Burleson, Peter Schrager and Kyle Brandt, and Executive Produced by Michael Davies, Good Morning Football airs live Monday–Friday at 7:00 a.m. ET on NFL Network from CBS Broadcast Center in New York City. The three-hour live show is NFL Network's first show to originate from New York City in the network's nearly 13 year history. Good Morning Football will re-air Monday–Friday starting at 10:00 a.m. ET.",https://static.tvmaze.com/uploads/images/medium_portrait/78/195574.jpg,2026-06-20T06:44:25+00:00
"Money, Power, Politics with Stephanie Ruhle",series,2026-06-19,TVMaze US,https://www.tvmaze.com/shows/91903/money-power-politics-with-stephanie-ruhle,"Money, Power, Politics with Stephanie Ruhle, utilizing her extensive Wall Street background to analyze the high-stakes intersection of money, power, and politics, Stephanie Ruhle delivers original reporting and hard-hitting interviews on the stories that directly affect Americans' lives. The program focuses on business and political news, featuring the ""Nightcap"" roundtable segment from her previous show, The 11th Hour",https://static.tvmaze.com/uploads/images/medium_portrait/629/1572501.jpg,2026-06-20T06:44:25+00:00
National Report,series,2026-06-19,TVMaze US,https://www.tvmaze.com/shows/76916/national-report,"National Report with Shaun Kraisman and Emma Rechenberg for live breaking news from NY and Washington, on politics, health, finance, and lifestyle that impact you.",https://static.tvmaze.com/uploads/images/medium_portrait/518/1297264.jpg,2026-06-20T06:44:25+00:00
NewsNation Live with Marni Hughes,series,2026-06-19,TVMaze US,https://www.tvmaze.com/shows/76884/newsnation-live-with-marni-hughes,NewsNation Live with Marni Hughes brings you a fast-paced look at the latest from the border to Main Street to the White House and around the globe.,https://static.tvmaze.com/uploads/images/medium_portrait/519/1297796.jpg,2026-06-20T06:44:25+00:00
Varney & Company,series,2026-06-19,TVMaze US,https://www.tvmaze.com/shows/10598/varney-company,"Varney & Company is hosted by veteran business journalist Stuart Varney, noted for his distinctive British accent, hosts this weekday morning program on which he and his guests discuss the implications of political news on the business world, and also how the news of the day affects personal finances. The company Varney keeps includes regular contributors Charles Payne, Sandra Smith and Elizabeth MacDonald, who weigh in on such issues as government spending, health care and bailouts.",https://static.tvmaze.com/uploads/images/medium_portrait/614/1536223.jpg,2026-06-20T06:44:25+00:00
Today 3rd Hour,series,2026-06-19,TVMaze US,https://www.tvmaze.com/shows/72466/today-3rd-hour,"A news program intended to inform, entertain, inspire and set the agenda each morning. Each daily live broadcast provides current domestic and international news, weather reports, and interviews with newsmakers from the worlds of politics, business, media, entertainment and sports.",https://static.tvmaze.com/uploads/images/medium_portrait/608/1520443.jpg,2026-06-20T06:44:25+00:00
