title,kind,release_date,source,source_url,summary,poster_url,updated_at
Watch What Happens Live,series,2026-06-18,TVMaze US,https://www.tvmaze.com/shows/2836/watch-what-happens-live,"Watch What Happens Live is an interactive series hosted by Bravo programming executive Andy Cohen, Bravo's Senior Vice President of Original Programming and Development, is best known to viewers as the host of the network's often explosive Watch What Happen s reunion specials. Watch What Happens originally debuted as a live online show on www.bravotv.com. Watch What Happens welcomes guests from some of the cable network's most popular series, as well as other entertainment stars, to chat about pop culture and celebrities in the news!",https://static.tvmaze.com/uploads/images/medium_portrait/593/1484372.jpg,2026-06-20T06:44:25+00:00
Killer Investigations,series,2026-06-18,TVMaze US,https://www.tvmaze.com/shows/87104/killer-investigations,"Detectives chase down leads, prosecutors go head-to-head with defense attorneys, and juries wrestle with life-or-death decisions.",https://static.tvmaze.com/uploads/images/medium_portrait/594/1487322.jpg,2026-06-20T06:44:25+00:00
Ancient Aliens,series,2026-06-18,TVMaze US,https://www.tvmaze.com/shows/675/ancient-aliens,"Ancient Aliens explores the controversial theory that extraterrestrials have visited Earth for millions of years. From the age of the dinosaurs to ancient Egypt, from early cave drawings to continued mass sightings in the US, each episode in this hit History series gives historic depth to the questions, speculations, provocative controversies, first-hand accounts and grounded theories surrounding this age old debate. Did intelligent beings from outer space visit Earth thousands of years ago?",https://static.tvmaze.com/uploads/images/medium_portrait/561/1403626.jpg,2026-06-20T06:44:25+00:00
The Last Word with Lawrence O'Donnell,series,2026-06-18,TVMaze US,https://www.tvmaze.com/shows/9312/the-last-word-with-lawrence-odonnell,"Drawing upon his experience as a former chief of staff on the Senate Finance Committee and as an Emmy-winning executive producer and writer of The West Wing, O'Donnell gives the last word and rewrites the most compelling stories of the day on The Last Word with Lawrence O'Donnell .",https://static.tvmaze.com/uploads/images/medium_portrait/619/1549332.jpg,2026-06-20T06:44:25+00:00
Chris Plante: The Right Squad,series,2026-06-18,TVMaze US,https://www.tvmaze.com/shows/76964/chris-plante-the-right-squad,"Chris Plante and his ""THE RIGHT SQUAD"" are the most interesting, informative and funny group of talking heads in the world! It's a big claim. But it's true!",https://static.tvmaze.com/uploads/images/medium_portrait/519/1298281.jpg,2026-06-20T06:44:25+00:00
Katie Pavlich Tonight,series,2026-06-18,TVMaze US,https://www.tvmaze.com/shows/90157/katie-pavlich-tonight,Katie Pavlich Tonight offers a conservative take on the day's events while welcoming all viewpoints. The goal: cutting through left-right bias in pursuit of plain facts and honest analysis.,https://static.tvmaze.com/uploads/images/medium_portrait/611/1529530.jpg,2026-06-20T06:44:25+00:00
SEC Now,series,2026-06-18,TVMaze US,https://www.tvmaze.com/shows/8661/sec-now,"The flagship news and information program of the SEC Network -- ESPN's 24/7 multiplatform sports network devoted to the Southeastern Conference -- is SEC Now , broadcast weekdays from the network's studios in Charlotte, N.C. Hosted by Dari Nowkhah, the show includes a mix of sports coverage, in-depth features, insider access, and exclusive interviews with the movers and shakers of the conference's 14 teams.",https://static.tvmaze.com/uploads/images/medium_portrait/30/77094.jpg,2026-06-20T06:44:25+00:00
The Daily Show,series,2026-06-18,TVMaze US,https://www.tvmaze.com/shows/66198/the-daily-show,"Hosted by a rotating cast of comedy greats, The Daily Show remains the go-to source for provocative satire, insightful interviews and an award-winning team of correspondents and contributors.",https://static.tvmaze.com/uploads/images/medium_portrait/567/1419577.jpg,2026-06-20T06:44:25+00:00
The 11th Hour with Ali Velshi,series,2026-06-18,TVMaze US,https://www.tvmaze.com/shows/61605/the-11th-hour-with-ali-velshi,"Ali Velshi delivers sharp, data-driven analysis of the day's biggest stories.",https://static.tvmaze.com/uploads/images/medium_portrait/619/1549476.jpg,2026-06-20T06:44:25+00:00
Jesse Weber Live,series,2026-06-18,TVMaze US,https://www.tvmaze.com/shows/90158/jesse-weber-live,"A fresh, fast-paced, and often unexpected take on the day's headlines, diving into the biggest stories through the lens of an expert in legal affairs.",https://static.tvmaze.com/uploads/images/medium_portrait/611/1529553.jpg,2026-06-20T06:44:25+00:00
Jimmy Kimmel Live,series,2026-06-18,TVMaze US,https://www.tvmaze.com/shows/1388/jimmy-kimmel-live,"Jimmy Kimmel Live features a diverse lineup of guests that include celebrities, athletes, musical acts, comedians and human-interest subjects, along with comedy bits and a house band.",https://static.tvmaze.com/uploads/images/medium_portrait/565/1413031.jpg,2026-06-20T06:44:25+00:00
The Story Is with Elex Michaelson,series,2026-06-18,TVMaze US,https://www.tvmaze.com/shows/87855/the-story-is-with-elex-michaelson,"The Story Is will feature live nightly panels and debates on set featuring a range of voices including attorneys Gloria Allred and Areva Martin, conservative talk radio hosts Larry Elder and Jennifer Horn, progressive podcast host Brian Tyler Cohen, former California GOP chair Jessica Millan Patterson and journalists Peter Hamby from Puck and POLITICO's Melanie Mason.",https://static.tvmaze.com/uploads/images/medium_portrait/614/1536142.jpg,2026-06-20T06:44:25+00:00
Late Night with Seth Meyers,series,2026-06-18,TVMaze US,https://www.tvmaze.com/shows/363/late-night-with-seth-meyers,"Seth Meyers, who is Saturday Night Live's longest serving anchor on the show's wildly popular ""Weekend Update,"" takes over as host of NBC's Late Night — home to A-list celebrity guests, memorable comedy and the best in musical talent. As the Emmy Award-winning head writer for ""SNL,"" Meyers has established a reputation for sharp wit and perfectly timed comedy, and has gained fame for his spot-on jokes and satire. Meyers takes his departure from ""SNL"" to his new post at ""Late Night,"" as Jimmy Fallon moves to The Tonight Show.",https://static.tvmaze.com/uploads/images/medium_portrait/506/1265488.jpg,2026-06-20T06:44:25+00:00
The Source with Kaitlan Collins,series,2026-06-18,TVMaze US,https://www.tvmaze.com/shows/69831/the-source-with-kaitlan-collins,"The Source with Kaitlan Collins - Kaitlan Collins chases the facts, asks the tough questions, and connects with her sources in primetime.",https://static.tvmaze.com/uploads/images/medium_portrait/614/1536138.jpg,2026-06-20T06:44:25+00:00
CNN NewsNight with Abby Phillip,series,2026-06-18,TVMaze US,https://www.tvmaze.com/shows/71645/cnn-newsnight-with-abby-phillip,"In CNN NewsNight with Abby Phillip , she delivers a thoughtful, sharp approach to the day's biggest stories.",https://static.tvmaze.com/uploads/images/medium_portrait/614/1536140.jpg,2026-06-20T06:44:25+00:00
Way Too Early,series,2026-06-17,TVMaze US,https://www.tvmaze.com/shows/15308/way-too-early,The fast-paced program brings viewers everything they need to know to start their days--from news and politics to sports and pop culture.,https://static.tvmaze.com/uploads/images/medium_portrait/619/1549472.jpg,2026-06-20T06:44:24+00:00
FOX Weather First,series,2026-06-17,TVMaze US,https://www.tvmaze.com/shows/86122/fox-weather-first,Waking up at 5 am to the first live national forecast of the day; all the latest weather news and everything one needs to prepare for the day ahead.,,2026-06-20T06:44:24+00:00
FOX & Friends First,series,2026-06-17,TVMaze US,https://www.tvmaze.com/shows/9966/fox-friends-first,"Kicking off the day, FOX & Friends First delivers all the headlines viewers may have missed overnight, along with a preview of upcoming news events. Presented two hours before FOX & Friends, the first hour of the program is hosted by Todd Piro and Carley Shimkus",https://static.tvmaze.com/uploads/images/medium_portrait/614/1536193.jpg,2026-06-20T06:44:24+00:00
Morning Joe,series,2026-06-17,TVMaze US,https://www.tvmaze.com/shows/15309/morning-joe,"On Morning Joe , the hosts Joe Scarborough, Mika Brzezinski, and Willie Geist engage in dynamic discussion about political news and issues important to all Americans. Morning Joe attracts a variety of guests, including top newsmakers, politicians and cultural influencers.",https://static.tvmaze.com/uploads/images/medium_portrait/619/1549478.jpg,2026-06-20T06:44:24+00:00
Wake Up America Early,series,2026-06-17,TVMaze US,https://www.tvmaze.com/shows/86410/wake-up-america-early,"Wake up to reliable reporting that delivers the essential facts you need to start your day informed, along with expert commentary and thoughtful analysis. Get an early look at the top stories shaping national and global conversations. Whether it's politics, business, culture, or breaking news, you'll be prepared for whatever the day brings.",,2026-06-20T06:44:24+00:00
Morning in America,series,2026-06-17,TVMaze US,https://www.tvmaze.com/shows/76534/morning-in-america,Morning in America is NewsNation's live national morning newscast hosted by Markie Martin.,https://static.tvmaze.com/uploads/images/medium_portrait/519/1297794.jpg,2026-06-20T06:44:24+00:00
Mornings with Maria,series,2026-06-17,TVMaze US,https://www.tvmaze.com/shows/71565/mornings-with-maria,Veteran business journalist Maria Bartiromo brings her knowledge of the financial industry to this early show that features a roundtable of rotating industry experts alongside the host. Bartiromo and her guests discuss news stories -- domestic and international -- and other topics that are expected to impact the economy and markets that day. The show's intent is to give viewers a jump-start on making moves to get the most out of their investments.,https://static.tvmaze.com/uploads/images/medium_portrait/614/1536222.jpg,2026-06-20T06:44:24+00:00
FOX & Friends,series,2026-06-17,TVMaze US,https://www.tvmaze.com/shows/9965/fox-friends,"FOX & Friends is a conservative American early-morning news and opinion talk show on the Fox News Channel. It begins at 6:00 a.m. Eastern Time with the latest Fox News Live headlines and news of the morning and continues with a variety of segments including current events, interviews, updates of news stories with correspondents, right-leaning analysis from the hosts, and entertainment segments.",https://static.tvmaze.com/uploads/images/medium_portrait/614/1536192.jpg,2026-06-20T06:44:24+00:00
Wake Up America,series,2026-06-17,TVMaze US,https://www.tvmaze.com/shows/76913/wake-up-america,"Start your day and weekend with real news and analysis from Rob Finnerty, Michael Grimm & Sarah Williamson and team.",https://static.tvmaze.com/uploads/images/medium_portrait/522/1306601.jpg,2026-06-20T06:44:24+00:00
Good Morning America,series,2026-06-17,TVMaze US,https://www.tvmaze.com/shows/8566/good-morning-america,"Good Morning America is a two-hour, live program anchored by Robin Roberts, George Stephanopoulos and Michael Strahan. Lara Spencer is the entertainmnt anchor, and Ginger Zee is the chief meteorologist.",https://static.tvmaze.com/uploads/images/medium_portrait/449/1122639.jpg,2026-06-20T06:44:24+00:00
Today,series,2026-06-17,TVMaze US,https://www.tvmaze.com/shows/9564/today,"Today is an American news and talk morning television show that airs on NBC. The program debuted on January 14, 1952. It was the first of its genre on American television and in the world, and is the fifth-longest-running American television series.",https://static.tvmaze.com/uploads/images/medium_portrait/564/1410938.jpg,2026-06-20T06:44:24+00:00
CBS Mornings,series,2026-06-17,TVMaze US,https://www.tvmaze.com/shows/66084/cbs-mornings,"CBS Mornings offers a thoughtful, substantive and insightful source of news and information to a daily audience of 3 million viewers. The Emmy Award-winning broadcast presents a mix of daily news, coverage of developing stories of national and global significance, and interviews with leading figures in politics, business and entertainment.",https://static.tvmaze.com/uploads/images/medium_portrait/605/1514144.jpg,2026-06-20T06:44:24+00:00
Good Morning Football,series,2026-06-17,TVMaze US,https://www.tvmaze.com/shows/21738/good-morning-football,"Prior to the start of the 2016 NFL regular season, NFL Network has announced a new daily morning show, Good Morning Football , premiering Monday, August 1. Hosted by Kay Adams, Nate Burleson, Peter Schrager and Kyle Brandt, and Executive Produced by Michael Davies, Good Morning Football airs live Monday–Friday at 7:00 a.m. ET on NFL Network from CBS Broadcast Center in New York City. The three-hour live show is NFL Network's first show to originate from New York City in the network's nearly 13 year history. Good Morning Football will re-air Monday–Friday starting at 10:00 a.m. ET.",https://static.tvmaze.com/uploads/images/medium_portrait/78/195574.jpg,2026-06-20T06:44:24+00:00
"Money, Power, Politics with Stephanie Ruhle",series,2026-06-17,TVMaze US,https://www.tvmaze.com/shows/91903/money-power-politics-with-stephanie-ruhle,"Money, Power, Politics with Stephanie Ruhle, utilizing her extensive Wall Street background to analyze the high-stakes intersection of money, power, and politics, Stephanie Ruhle delivers original reporting and hard-hitting interviews on the stories that directly affect Americans' lives. The program focuses on business and political news, featuring the ""Nightcap"" roundtable segment from her previous show, The 11th Hour",https://static.tvmaze.com/uploads/images/medium_portrait/629/1572501.jpg,2026-06-20T06:44:24+00:00
National Report,series,2026-06-17,TVMaze US,https://www.tvmaze.com/shows/76916/national-report,"National Report with Shaun Kraisman and Emma Rechenberg for live breaking news from NY and Washington, on politics, health, finance, and lifestyle that impact you.",https://static.tvmaze.com/uploads/images/medium_portrait/518/1297264.jpg,2026-06-20T06:44:24+00:00
NewsNation Live with Marni Hughes,series,2026-06-17,TVMaze US,https://www.tvmaze.com/shows/76884/newsnation-live-with-marni-hughes,NewsNation Live with Marni Hughes brings you a fast-paced look at the latest from the border to Main Street to the White House and around the globe.,https://static.tvmaze.com/uploads/images/medium_portrait/519/1297796.jpg,2026-06-20T06:44:24+00:00
Varney & Company,series,2026-06-17,TVMaze US,https://www.tvmaze.com/shows/10598/varney-company,"Varney & Company is hosted by veteran business journalist Stuart Varney, noted for his distinctive British accent, hosts this weekday morning program on which he and his guests discuss the implications of political news on the business world, and also how the news of the day affects personal finances. The company Varney keeps includes regular contributors Charles Payne, Sandra Smith and Elizabeth MacDonald, who weigh in on such issues as government spending, health care and bailouts.",https://static.tvmaze.com/uploads/images/medium_portrait/614/1536223.jpg,2026-06-20T06:44:24+00:00
Today 3rd Hour,series,2026-06-17,TVMaze US,https://www.tvmaze.com/shows/72466/today-3rd-hour,"A news program intended to inform, entertain, inspire and set the agenda each morning. Each daily live broadcast provides current domestic and international news, weather reports, and interviews with newsmakers from the worlds of politics, business, media, entertainment and sports.",https://static.tvmaze.com/uploads/images/medium_portrait/608/1520443.jpg,2026-06-20T06:44:24+00:00
America's Newsroom,series,2026-06-17,TVMaze US,https://www.tvmaze.com/shows/10093/americas-newsroom,Watch ' America's Newsroom ' on Fox News Channel - follow Bill Hemmer and Dana Perino Weekdays 9 a.m. - 11 a.m. ET as they bring you the news that matters to you.,https://static.tvmaze.com/uploads/images/medium_portrait/614/1536195.jpg,2026-06-20T06:44:24+00:00
First Take,series,2026-06-17,TVMaze US,https://www.tvmaze.com/shows/22382/first-take,"First Take (aka: ESPN First Take) is a weekday sports talk show co-hosted by Stephen A. Smith, Max Kellerman and Molly Qerim who are joined by regular contributors and special guests. The show includes daily sports news, interviews with sports journalists, athletes and personalities, spirited debates, and an assortment of other topics. The show debuted 7 May 2007 as ""Cold Pizza"".",https://static.tvmaze.com/uploads/images/medium_portrait/82/205434.jpg,2026-06-20T06:44:24+00:00
CBS News 24/7,series,2026-06-17,TVMaze US,https://www.tvmaze.com/shows/77453/cbs-news-247,Live news and top stories on CBS News 24/7.,,2026-06-20T06:44:24+00:00
TODAY with Jenna & Sheinelle,series,2026-06-17,TVMaze US,https://www.tvmaze.com/shows/88879/today-with-jenna-sheinelle,"America's feel-good morning show with big stars and sweet surprises; Jenna Bush Hager and Sheinelle Jones host an hour of heartfelt connection, inspirational stories, fun and laughs.",https://static.tvmaze.com/uploads/images/medium_portrait/608/1520440.jpg,2026-06-20T06:44:24+00:00
The View,series,2026-06-17,TVMaze US,https://www.tvmaze.com/shows/6048/the-view,"The View is a live, one-hour daily talk show from ABC co-hosted by Whoopi Goldberg, Joy Behar, Sunny Hostin, Sara Haines, and Meghan McCain. It is the original forum in which real women discuss everyday issues, share their opinions and engage in colorful conversations.",https://static.tvmaze.com/uploads/images/medium_portrait/587/1467740.jpg,2026-06-20T06:44:24+00:00
MS NOW Reports,series,2026-06-17,TVMaze US,https://www.tvmaze.com/shows/71555/ms-now-reports,"MS NOW Reports (formerly MSNBC) offers a live, breaking news format focusing on top political stories, daily events, and human interest segments, providing in-depth coverage of US/world news, politics, and business with familiar anchors, emphasizing justice, truth, and impact on viewers, all under the new ""MS NOW: My Source for News, Opinion, and the World"" brand .",https://static.tvmaze.com/uploads/images/medium_portrait/619/1549482.jpg,2026-06-20T06:44:24+00:00
The Faulkner Focus,series,2026-06-17,TVMaze US,https://www.tvmaze.com/shows/75842/the-faulkner-focus,Emmy-winning journalist Harris Faulkner provides the latest news driving the day with insightful analysis and interviews with top newsmakers.,https://static.tvmaze.com/uploads/images/medium_portrait/614/1536204.jpg,2026-06-20T06:44:24+00:00
On the Line with Alicia Menendez,series,2026-06-17,TVMaze US,https://www.tvmaze.com/shows/91902/on-the-line-with-alicia-menendez,"On the Line with Alicia Menendez moves beyond the headlines to examine the stories shaping the nation, featuring one-on-one conversations with newsmakers and a focus on voices often left out of the political discourse",https://static.tvmaze.com/uploads/images/medium_portrait/628/1572499.jpg,2026-06-20T06:44:24+00:00
Newsline,series,2026-06-17,TVMaze US,https://www.tvmaze.com/shows/76967/newsline,"Bianca de la Garza tackles the big news from D.C., N.Y., across America, and around the world!",,2026-06-20T06:44:24+00:00
NewsNation Live with Nichole Berlie,series,2026-06-17,TVMaze US,https://www.tvmaze.com/shows/76885/newsnation-live-with-nichole-berlie,The day's top news headlines with reports from correspondents around the country.,https://static.tvmaze.com/uploads/images/medium_portrait/519/1297795.jpg,2026-06-20T06:44:24+00:00
The Big Money Show,series,2026-06-17,TVMaze US,https://www.tvmaze.com/shows/76779/the-big-money-show,"Taylor Riggs, Brian Brenberg and Jackie DeAngelis host an informative and fast-paced hour filled with business topics that impact everyone from Wall Street to the average person.",https://static.tvmaze.com/uploads/images/medium_portrait/614/1536233.jpg,2026-06-20T06:44:24+00:00
NBC News Daily,series,2026-06-17,TVMaze US,https://www.tvmaze.com/shows/73192/nbc-news-daily,NBC News provides viewers with up-to-the-minute national and international news.,https://static.tvmaze.com/uploads/images/medium_portrait/497/1243761.jpg,2026-06-20T06:44:24+00:00
Outnumbered,series,2026-06-17,TVMaze US,https://www.tvmaze.com/shows/18862/outnumbered,"Featuring an ensemble of four female panelists and one rotating male, Outnumbered examines the top news stories as well as the leading pop culture and relationship issues dominating the headlines. FNC's Harris Faulkner, Kayleigh McEnany and Emily Compagno lead the program's coverage, while alternating co-panelists weigh in with analysis.",https://static.tvmaze.com/uploads/images/medium_portrait/614/1536198.jpg,2026-06-20T06:44:24+00:00
The Young and the Restless,series,2026-06-17,TVMaze US,https://www.tvmaze.com/shows/4344/the-young-and-the-restless,"The Young and the Restless revolves around the rivalries, romances, hopes and fears of the residents of the fictional Midwestern metropolis, Genoa City. The lives and loves of a wide variety of characters mingle through the generations, dominated by the Newman, Abbott, Chancellor, Baldwin and Winters families. ­ When The Young and the Restless premiered in 1973, it revolutionized the daytime drama. It continues to set the standard with strong characters, socially conscious storylines, romance and sensuality.",https://static.tvmaze.com/uploads/images/medium_portrait/593/1482522.jpg,2026-06-20T06:44:24+00:00
GMA3,series,2026-06-17,TVMaze US,https://www.tvmaze.com/shows/72930/gma3,"GMA3 is a news, health, lifestyle and shopping program.",https://static.tvmaze.com/uploads/images/medium_portrait/586/1465552.jpg,2026-06-20T06:44:24+00:00
America Reports,series,2026-06-17,TVMaze US,https://www.tvmaze.com/shows/75854/america-reports,A look at the latest news and headlines with Sandra Smith and John Roberts,https://static.tvmaze.com/uploads/images/medium_portrait/614/1536216.jpg,2026-06-20T06:44:24+00:00
The Bold and the Beautiful,series,2026-06-17,TVMaze US,https://www.tvmaze.com/shows/806/the-bold-and-the-beautiful,"They created a dynasty where passion rules, they are the Forresters, the first name in Fashion. The Bold and the Beautiful , a world of fashion, glamor and romance. A place where power, money and success are there for the taking in a city where dreams really do come true. Follow the lives and loves of the Forresters on The Bold and the Beautiful ...",https://static.tvmaze.com/uploads/images/medium_portrait/593/1482536.jpg,2026-06-20T06:44:24+00:00
The Moment with Katy Tur,series,2026-06-17,TVMaze US,https://www.tvmaze.com/shows/91901/the-moment-with-katy-tur,The Moment with Katy Tur is designed to move beyond the immediate headlines to provide deeper context and understanding of the political and national stories shaping the day.,https://static.tvmaze.com/uploads/images/medium_portrait/628/1571887.jpg,2026-06-20T06:44:24+00:00
American Agenda,series,2026-06-17,TVMaze US,https://www.tvmaze.com/shows/76968/american-agenda,"American Agenda with hosts Bob Brooks & Katrina Szish is a live, fast-paced look at national news and international events. The program brings viewers the latest from Washington, with insightful analysis from lawmakers and experts, and media reports from New York and around the globe.",https://static.tvmaze.com/uploads/images/medium_portrait/519/1298177.jpg,2026-06-20T06:44:24+00:00
Making Money with Charles Payne,series,2026-06-17,TVMaze US,https://www.tvmaze.com/shows/10185/making-money-with-charles-payne,"Long-time Wall Street broker and analyst Charles Payne hosts his own daily program Making Money with Charles Payne that helps viewers spot emerging investment prospects. A panel of business and market specialists joins him to discuss the latest headlines, wrap up the day's activities in the markets, and focus on tomorrow's moneymakers. Payne says, ""There are money-making opportunities behind every headline."" His goal is to help viewers ""find their confidence in the markets and realize their long-term dreams and goals.""",https://static.tvmaze.com/uploads/images/medium_portrait/614/1536224.jpg,2026-06-20T06:44:24+00:00
Beyond the Gates,series,2026-06-17,TVMaze US,https://www.tvmaze.com/shows/75194/beyond-the-gates,"Beyond the Gates is set in a leafy Maryland suburb just outside of Washington D.C., and in one the most affluent African American counties in the United States. Here you'll find a posh gated community with winding tree-lined streets and luxurious mansions to call home. At the center of this community are the Duprees, a powerful and prestigious multi-generational family that is the very definition of Black royalty. But behind these pristine walls and lush, manicured gardens are juicy secrets and scandals waiting to be uncovered. And those that live outside these gates are watching closely. These are the places where our characters live, love, work and play. Those who have ""made it"" and those who haven't are all trying to navigate life … and some with more grace than others.",https://static.tvmaze.com/uploads/images/medium_portrait/593/1482540.jpg,2026-06-20T06:44:24+00:00
